<DomainActions xmlns:xsi="http://www.w3.org/2001/XMLSchema-instance"
xsi:noNamespaceSchemaLocation="./schemas/Actions.xsd">
	
	<Action name="talk([target])">
		<PreConditions>																																							
		</PreConditions>
		<Effects>
		</Effects>
		<EffectsOnDrives>
			<Motivator drive="Energy" target="[AGENT]" value="-1"/>
		</EffectsOnDrives>
	</Action>
	
	<Action name="Chikaka()">
		<PreConditions>
		</PreConditions>
		<Effects>
		</Effects>
		<EffectsOnDrives>
			<Motivator drive="Energy" target="[AGENT]" value="-0.5"/>
			<Motivator drive="Affiliation" target="[AGENT]" value="+1"/>
		</EffectsOnDrives>
	</Action>
	
	<Action name="bow([target])">
		<PreConditions>
			<Property name="[target]" operator="!=" value="[AGENT]"/>
     		</PreConditions>
		<Effects>
		</Effects>
		<EffectsOnDrives>
			<Motivator drive="Energy" target="[AGENT]" value="-1"/>
		</EffectsOnDrives>
	</Action>

  <Action name="walk-to-party()">
    <PreConditions>
    </PreConditions>
    <Effects>
    </Effects>
    <EffectsOnDrives>
      <Motivator drive="Energy" target="[AGENT]" value="-1"/>
    </EffectsOnDrives>
  </Action>
	
	<Action name="wave-hand([target])">
		<PreConditions>
			<Property name="[target]" operator="!=" value="[AGENT]"/>
     	</PreConditions>
		<Effects>
		</Effects>
		<EffectsOnDrives>
			<Motivator drive="Energy" target="[AGENT]" value="-1"/>
		</EffectsOnDrives>
	</Action>
	
	<Action name="thumb-up([target])">
		<PreConditions>
			<Property name="[target]" operator="!=" value="[AGENT]"/>
     	</PreConditions>
		<Effects>
		</Effects>
		<EffectsOnDrives>
			<Motivator drive="Energy" target="[AGENT]" value="-1"/>
		</EffectsOnDrives>
	</Action>
	
	<Action name="give-object([target])">
		<PreConditions>
			<Property name="[target]" operator="!=" value="[AGENT]"/>
     	</PreConditions>
		<Effects>
		</Effects>
		<EffectsOnDrives>
			<Motivator drive="Energy" target="[AGENT]" value="-1"/>
		</EffectsOnDrives>
	</Action>
	
	<Action name="spit-standing([target])">
		<PreConditions>
			<Property name="[target]" operator="!=" value="[AGENT]"/>
     	</PreConditions>
		<Effects>
		</Effects>
		<EffectsOnDrives>
			<Motivator drive="Energy" target="[AGENT]" value="-1"/>
		</EffectsOnDrives>
	</Action>
	
	<Action name="greeting([target])">
		<PreConditions>
			<Property name="[target]" operator="!=" value="[AGENT]"/>
     	</PreConditions>
		<Effects>
		</Effects>
		<EffectsOnDrives>
			<Motivator drive="Energy" target="[AGENT]" value="-1"/>
		</EffectsOnDrives>
	</Action>
	
	<!-- General SpeechAct -->
	<Action name="SpeechAct([target],[type])">
		<PreConditions>
			<Property name="[target]" operator="!=" value="[AGENT]"/>
			<Property name="[type]" operator="!=" value="protest"/>
			<Property name="[type]" operator="!=" value="deceptionreveal"/>
			<Property name="[type]" operator="!=" value="annoy"/>
			<Property name="[type]" operator="!=" value="laughoff"/>
			<Property name="[type]" operator="!=" value="followdontcare"/>
		</PreConditions>
		<Effects>
			<Effect probability="1">
				<Property name="SpeechContext()" operator="=" value="#EVENT([AGENT],SpeechAct,[target],[type])"/>
			</Effect>
		</Effects>
		<EffectsOnDrives>
			<Motivator drive="Energy" target="[AGENT]" value="-1"/>
		</EffectsOnDrives>
	</Action>
	
	<!-- General SpeechAct that contains an additional topic -->
	<Action name="SpeechAct([target],[type],[topic])">
		<PreConditions>
			<Property name="[target]" operator="!=" value="[AGENT]"/>
			<Property name="[type]" operator="!=" value="joingroupquestionthreatleave"/>
			<Property name="[type]" operator="!=" value="joingroupquestionthreatleavepositiveanswer"/>
			<Property name="[type]" operator="!=" value="joingroupquestionthreatleavenegativeanswer"/>
			<Property name="[type]" operator="!=" value="joingroupquestionnegativeanswerobjectaccept"/>
			<Property name="[type]" operator="!=" value="joingroupquestionnegativeanswerobjectacceptanswer"/>
		</PreConditions>
		<Effects>
			<Effect probability="1">
				<Property name="SpeechContext()" operator="=" value="#EVENT([AGENT],SpeechAct,[target],[type],[topic])"/>
			</Effect>
		</Effects>
		<EffectsOnDrives>
			<Motivator drive="Energy" target="[AGENT]" value="-1"/>
		</EffectsOnDrives>
	</Action>
	<!-- General Reinforcement SpeechAct -->
	<Action name="Reinforce([target],[type])">
		<PreConditions>
			<Property name="[target]" operator="!=" value="[AGENT]"/>
		</PreConditions>
		<Effects>
		</Effects>
		<EffectsOnDrives>
		</EffectsOnDrives>
	</Action>
	<!-- General Question SpeechAct -->
	<Action name="Question([target],[question])">
		<PreConditions>
			<Property name="[question]" operator="!=" value="threatfightback"/>
			<Property name="[question]" operator="!=" value="laughoff"/>
			<Property name="[question]" operator="!=" value="protest"/>
			<Property name="[question]" operator="!=" value="askforadvice"/>
			<Property name="[question]" operator="!=" value="askforadvice2nd"/>
			<Property name="[question]" operator="!=" value="askagain"/>
			<Property name="[target]" operator="!=" value="[AGENT]"/>
		</PreConditions>
		<Effects>
			<Effect probability="1">
				<Property name="SpeechContext()" operator="=" value="#EVENT([AGENT],Question,[target],[question])"/>
			</Effect>
		</Effects>
		<EffectsOnDrives>
			<Motivator drive="Energy" target="[AGENT]" value="-1"/>
		</EffectsOnDrives>
	</Action>
	<!-- General positive Reply SpeechAct. It's probability of execution by another agent is a little higher because this Reply is incentivated
	      by a question -->
	<Action name="Reply([target],[question],positiveanswer)" probability="0.5">
		<PreConditions>
			<Property name="[target]" operator="!=" value="[AGENT]"/>
			<Property name="[question]" operator="!=" value="joingroupquestionnegativeanswerobject"/>
			<Property name="SpeechContext()" operator="=" value="#EVENT([target],Question,[AGENT],[question])"/>
		</PreConditions>
		<Effects>
			<Effect probability="1">
				<Property name="SpeechContext()" operator="=" value="#EVENT([AGENT],Reply,[target],[question],positiveanswer)"/>
			</Effect>
		</Effects>
		<EffectsOnDrives>
			<Motivator drive="Energy" target="[AGENT]" value="-1"/>
		</EffectsOnDrives>
	</Action>
	<!-- General negative Reply SpeechAct. It's probability of execution by another agent is a little higher because this Reply is incentivated
	      by a question. Additionally, saying no has some likelihood of getting hurt. -->
	<Action name="Reply([target],[question],negativeanswer)" probability="0.5">
		<PreConditions>
			<Property name="[target]" operator="!=" value="[AGENT]"/>
			<Property name="[question]" operator="!=" value="joinparty"/>
			<Property name="SpeechContext()" operator="=" value="#EVENT([target],Question,[AGENT],[question])"/>
		</PreConditions>
		<Effects>
			<Effect probability="0.4">
				<Property name="[AGENT](atRisk)" operator="=" value="True"/>
			</Effect>
			<Effect probability="1">
				<Property name="SpeechContext()" operator="=" value="#EVENT([AGENT],Reply,[target],[question],positiveanswer)"/>
			</Effect>
		</Effects>
		<EffectsOnDrives>
			<Motivator drive="Energy" target="[AGENT]" value="-1"/>
		</EffectsOnDrives>
	</Action>
</DomainActions>
